{
  "eventId": "event-panel",
  "kind": "trigger.panel/v1",
  "version": "v1",
  "occurredAt": "2026-08-12T12:00:00Z",
  "receivedAt": "2026-08-12T12:00:00Z",
  "sourceRef": "panel-source",
  "actorRef": "panel-actor",
  "payloadSchemaDigest": "sha256:aaaaaaaaaaaaaaaaaaaaaaaaaaaaaaaaaaaaaaaaaaaaaaaaaaaaaaaaaaaaaaaa",
  "payload": {}
}
