{
  "eventId": "event-schedule",
  "kind": "trigger.schedule/v1",
  "version": "v1",
  "occurredAt": "2026-08-12T12:00:00Z",
  "receivedAt": "2026-08-12T12:00:00Z",
  "sourceRef": "schedule-source",
  "actorRef": "scheduler-1",
  "payloadSchemaDigest": "sha256:aaaaaaaaaaaaaaaaaaaaaaaaaaaaaaaaaaaaaaaaaaaaaaaaaaaaaaaaaaaaaaaa",
  "payload": {}
}
